{
  "id": "osapqtdc",
  "partOfSpeech": "noun",
  "traditional": "幸福",
  "jyutping": "hang6 fuk1",
  "boxes": [
    {
      "meaning": "happiness, well-being",
      "english": [
        {
          "id": "okd7d67c",
          "word": "happiness",
          "meaning": "emotion of being happy",
          "note": "Use this for happiness understood as lasting well-being or a fortunate life situation rather than a moment of joy."
        },
        {
          "id": "djutkgj2",
          "word": "welfare",
          "meaning": "well-being",
          "note": "Use this when welfare is specifically about personal happiness and contentment rather than services or financial assistance."
        },
        {
          "id": "idwzm6in",
          "word": "bliss",
          "meaning": "perfect happiness",
          "note": "This is the all-purpose noun for perfect happiness, especially in phrases such as 「享受呢份幸福」."
        }
      ],
      "examples": [
        {
          "english": "Having my family around and a stable job gives me a lasting sense of happiness.",
          "traditional": "有屋企人陪住，又有份穩定嘅工，我覺得自己好幸福。",
          "jyutping": "jau5 uk1 kei2 jan4 pui4 zyu6 jau6 jau5 fan6 wan2 ding6 ge3 gung1 ngo5 gok3 dak1 zi6 gei2 hou2 hang6 fuk1"
        },
        {
          "english": "To me, welfare is having the whole family happy and content.",
          "traditional": "對我嚟講，幸福就係一家人開開心心、知足常樂。",
          "jyutping": "deoi3 ngo5 lai4 gong2 hang6 fuk1 zau6 hai6 jat1 gaa1 jan4 hoi1 hoi1 sam1 sam1 zi1 zuk1 soeng4 lok6"
        },
        {
          "english": "Having tea every day after retirement is truly bliss.",
          "traditional": "退休後每日飲茶，真係享受呢份幸福。",
          "jyutping": "teoi3 jau1 hau6 mui5 jat6 jam2 caa4 zan1 hai6 hoeng2 sau6 ne1 fan2 hang6 fuk1"
        }
      ]
    }
  ]
}
