{
  "id": "wxd643pz",
  "partOfSpeech": "verb",
  "traditional": "鑄",
  "jyutping": "zyu3",
  "boxes": [
    {
      "meaning": "make in a mould",
      "english": [
        {
          "id": "vzv6t4dh",
          "word": "cast",
          "meaning": "make in a mould",
          "note": "Use this specifically for making a metal object by pouring molten material into a mould."
        }
      ],
      "examples": [
        {
          "english": "This statue was cast in bronze.",
          "traditional": "呢尊銅像係用青銅鑄成嘅。",
          "jyutping": "ni1 zyun1 tung4 zoeng6 hai6 jung6 cing1 tung4 zyu3 sing4 ge3"
        }
      ]
    }
  ]
}
