{
  "id": "1h24y7ny",
  "partOfSpeech": "verb",
  "traditional": "散發出",
  "jyutping": "saan3 faat3 ceot1",
  "boxes": [
    {
      "meaning": "give off a feeling or atmosphere",
      "english": [
        {
          "id": "mhqgw8kt",
          "word": "radiate",
          "meaning": "show a feeling strongly",
          "note": "Use this when a person or their face seems to emanate a strong positive feeling or quality."
        },
        {
          "id": "2vdviacf",
          "word": "breathe",
          "meaning": "breathe out something",
          "note": "Use this when something gives off a smell or conveys an atmosphere or impression; it is not for ordinary human exhalation."
        }
      ],
      "examples": [
        {
          "english": "They radiate a reassuring warmth.",
          "traditional": "佢成日散發出一種令人安心嘅氣場。",
          "jyutping": "keoi5 seng4 jat6 saan3 faat3 ceot1 jat1 zung2 ling6 jan4 on1 sam1 ge3 hei3 coeng4"
        },
        {
          "english": "This old house seems to breathe out a spooky atmosphere.",
          "traditional": "呢間舊屋好似散發出一陣陰森嘅氣氛。",
          "jyutping": "ni1 gaan1 gau6 uk1 hou2 ci5 saan3 faat3 ceot1 jat1 zan6 jam1 sam1 ge3 hei3 fan1"
        }
      ]
    }
  ]
}
