{
  "id": "5eyjgv1y",
  "partOfSpeech": "noun",
  "traditional": "大洋",
  "jyutping": "daai6 joeng4",
  "boxes": [
    {
      "meaning": "large sea body",
      "english": [
        {
          "id": "0ao4d612",
          "word": "ocean",
          "meaning": "large sea body",
          "register": "written",
          "note": "Use this mainly for a geographically defined ocean as one of the large bodies separating continents."
        }
      ],
      "register": "written",
      "examples": [
        {
          "english": "The Pacific Ocean is the largest ocean in the world.",
          "traditional": "太平洋係世界上最大嘅大洋。",
          "jyutping": "taai3 ping4 joeng4 hai6 sai3 gaai3 soeng6 zeoi3 daai6 ge3 daai6 joeng4"
        }
      ]
    }
  ]
}
