{
  "id": "md1cdrfa",
  "partOfSpeech": "adj",
  "traditional": "寶貴",
  "jyutping": "bou2 gwai3",
  "boxes": [
    {
      "meaning": "valuable; of high worth",
      "english": [
        {
          "id": "1gk4g1ac",
          "word": "precious",
          "meaning": "valuable; of high worth",
          "note": "This is the all-purpose choice for something having high value or worth."
        }
      ],
      "examples": [
        {
          "english": "This document is precious, so please don't lose it.",
          "traditional": "呢份文件好寶貴，千祈唔好整唔見。",
          "jyutping": "ni1 fan6 man4 gin6 hou2 bou2 gwai3 cin1 kei4 m4 hou2 zing2 m4 gin3"
        }
      ]
    }
  ]
}
