{
  "id": "sozpbhfi",
  "partOfSpeech": "noun",
  "traditional": "暖色調",
  "jyutping": "nyun5 sik1 diu6",
  "boxes": [
    {
      "meaning": "warm colors",
      "english": [
        {
          "id": "r1hj0n3s",
          "word": "warmth",
          "meaning": "warm colors",
          "note": "Use 暖色調 in art and design for the warm visual effect created by mainly red and yellow hues."
        }
      ],
      "examples": [
        {
          "english": "This painting uses warm colours, making the whole living room feel warmer with a sense of warmth.",
          "traditional": "呢幅畫用暖色調，睇落成個客廳都溫暖啲。",
          "jyutping": "ni1 fuk1 waa2 jung6 nyun5 sik1 diu6 tai2 lok6 seng4 go3 haak3 teng1 dou1 wan1 nyun5 di1"
        }
      ]
    }
  ]
}
