{
  "id": "b07o9klr",
  "partOfSpeech": "verb",
  "traditional": "慢慢消失",
  "jyutping": "maan6 maan6 siu1 sat1",
  "boxes": [
    {
      "meaning": "gradually disappear",
      "english": [
        {
          "id": "r6u503yq",
          "word": "fade",
          "meaning": "gradually disappear",
          "note": "Use this as the all-purpose choice when something gradually disappears, grows dim, or fades into the distance."
        }
      ],
      "examples": [
        {
          "english": "The light in the distance slowly begins to fade into the fog.",
          "traditional": "遠處盞燈慢慢消失喺霧入面。",
          "jyutping": "jyun5 cyu3 zaan2 dang1 maan6 maan6 siu1 sat1 hai2 mou6 jap6 min6"
        }
      ]
    }
  ]
}
