{
  "id": "azuzorj1",
  "partOfSpeech": "verb",
  "traditional": "救",
  "jyutping": "gau3",
  "boxes": [
    {
      "meaning": "rescue, save",
      "english": [
        {
          "id": "j84lfsxe",
          "word": "rescue",
          "meaning": "save from danger",
          "note": "This is the all-purpose choice for saving someone from danger or harm."
        },
        {
          "id": "pga511hh",
          "word": "salvage",
          "meaning": "rescue",
          "note": "This is the all-purpose choice for rescuing someone or saving something from being lost or destroyed."
        },
        {
          "id": "1khw51ki",
          "word": "save",
          "meaning": "rescue from harm",
          "note": "Use 救 as the all-purpose verb for rescuing someone or, in sports, stopping a shot."
        }
      ],
      "examples": [
        {
          "english": "The firefighters finally rescue the man who fell into the sea.",
          "traditional": "消防員終於救咗嗰個跌落海嘅男人。",
          "jyutping": "siu1 fong4 jyun4 zung1 jyu1 gau3 zo2 go2 go3 dit3 lok6 hoi2 ge3 naam4 jan4"
        },
        {
          "english": "We need to salvage this shipment quickly before it gets soaked and ruined.",
          "traditional": "我哋快啲救返呢批貨，唔好畀佢哋浸爛。",
          "jyutping": "ngo5 dei6 faai3 di1 gau3 faan2 ni1 pai1 fo3 m4 hou2 bei2 keoi5 dei6 zam3 laan6"
        },
        {
          "english": "The goalkeeper managed to save the penalty.",
          "traditional": "龍門救到個十二碼。",
          "jyutping": "lung4 mun4 gau3 dou2 go3 sap6 ji6 maa5"
        }
      ]
    }
  ]
}
