{
  "id": "g6h35uhv",
  "partOfSpeech": "noun",
  "traditional": "沉船事故",
  "jyutping": "cam4 syun4 si6 gu3",
  "boxes": [
    {
      "meaning": "shipwrecking event",
      "english": [
        {
          "id": "w5pqqgge",
          "word": "shipwreck",
          "meaning": "shipwrecking event",
          "note": "Use this when referring explicitly to the shipwrecking event or accident rather than the wrecked vessel."
        }
      ],
      "examples": [
        {
          "english": "That shipwreck left many people missing.",
          "traditional": "嗰宗沉船事故造成多人失蹤。",
          "jyutping": "go2 zung1 cam4 syun4 si6 gu3 zou6 sing4 do1 jan4 sat1 zung1"
        }
      ]
    }
  ]
}
