{
  "id": "7lauqpxi",
  "partOfSpeech": "adj",
  "traditional": "可以郁嘅",
  "jyutping": "ho2 ji5 juk1 ge3",
  "boxes": [
    {
      "meaning": "movable on wheels",
      "english": [
        {
          "id": "2ibr2mrt",
          "word": "mobile",
          "meaning": "movable on wheels",
          "register": "colloquial",
          "note": "Use this for an object that can be moved, especially when contrasting it with something fixed in place."
        }
      ],
      "register": "colloquial",
      "examples": [
        {
          "english": "This table is mobile, but that one isn’t.",
          "traditional": "呢張枱可以郁嘅，嗰張就唔得。",
          "jyutping": "ni1 zoeng1 toi4 ho2 ji5 juk1 ge3 go2 zoeng1 zau6 m4 dak1"
        }
      ]
    }
  ]
}
