{
  "id": "zrq1z09x",
  "partOfSpeech": "noun",
  "traditional": "外科",
  "jyutping": "ngoi6 fo1",
  "boxes": [
    {
      "meaning": "surgical field",
      "english": [
        {
          "id": "swae48kc",
          "word": "surgery",
          "meaning": "surgical field",
          "note": "Use this when referring to surgery as the medical specialty or department."
        }
      ],
      "examples": [
        {
          "english": "They are studying surgery and want to become a surgeon.",
          "traditional": "佢讀緊外科，將來想做外科醫生。",
          "jyutping": "keoi5 duk6 gan2 ngoi6 fo1 zoeng1 loi4 soeng2 zou6 ngoi6 fo1 ji1 sang1"
        }
      ]
    }
  ]
}
