{
  "id": "jqaouu0t",
  "partOfSpeech": "noun",
  "traditional": "遮",
  "jyutping": "ze1",
  "boxes": [
    {
      "meaning": "rain/sun umbrella",
      "english": [
        {
          "id": "f0v2n9f8",
          "word": "umbrella",
          "meaning": "rain/sun umbrella",
          "note": "This is the all-purpose everyday word for an umbrella, whether used against rain or sun."
        }
      ],
      "examples": [
        {
          "english": "I remember to bring an umbrella when I go out.",
          "traditional": "我出門口記得帶遮。",
          "jyutping": "ngo5 ceot1 mun4 hau2 gei3 dak1 daai3 ze1"
        }
      ]
    }
  ]
}
