{
  "id": "smtrdadc",
  "partOfSpeech": "noun",
  "traditional": "帆船運動員",
  "jyutping": "faan4 syun4 wan6 dung6 jyun4",
  "boxes": [
    {
      "meaning": "sailing-boats sailor",
      "english": [
        {
          "id": "kn3mg0hb",
          "word": "sailor",
          "meaning": "sailing-boats sailor",
          "register": "formal",
          "note": "Use this for someone who sails a sailing boat as a sport or recreational activity rather than as ship’s crew."
        }
      ],
      "register": "formal",
      "examples": [
        {
          "english": "They are a sailor who competes for Hong Kong.",
          "traditional": "佢係帆船運動員，代表香港參加比賽。",
          "jyutping": "keoi5 hai6 faan4 syun4 wan6 dung6 jyun4 doi6 biu2 hoeng1 gong2 caam1 gaa1 bei2 coi3"
        }
      ]
    }
  ]
}
