{
  "id": "tfzmywew",
  "partOfSpeech": "noun",
  "traditional": "多樣性",
  "jyutping": "do1 joeng6 sing3",
  "boxes": [
    {
      "meaning": "diversity",
      "english": [
        {
          "id": "vjiqrv2n",
          "word": "variety",
          "meaning": "diversity",
          "register": "written",
          "note": "Use this for the abstract quality of diversity, especially in formal or written discussion."
        }
      ],
      "register": "written",
      "examples": [
        {
          "english": "This report examines the variety within Hong Kong society.",
          "traditional": "呢份報告探討香港社會嘅多樣性。",
          "jyutping": "ni1 fan6 bou3 gou3 taam3 tou2 hoeng1 gong2 se5 wui6 ge3 do1 joeng6 sing3"
        }
      ]
    }
  ]
}
