{
  "id": "3b2rms9s",
  "partOfSpeech": "noun",
  "traditional": "發展",
  "jyutping": "faat3 zin2",
  "boxes": [
    {
      "meaning": "process of developing",
      "english": [
        {
          "id": "vem4yllm",
          "word": "development",
          "meaning": "process of developing",
          "note": "This is the all-purpose noun for a process of growth or change and for new developments in the news."
        }
      ],
      "examples": [
        {
          "english": "There’s a new development in this news story.",
          "traditional": "呢單新聞有個新發展。",
          "jyutping": "ni1 daan1 san1 man4 jau5 go3 san1 faat3 zin2"
        }
      ]
    }
  ]
}
