{
  "id": "rttw1uvm",
  "partOfSpeech": "noun",
  "traditional": "狂迷",
  "jyutping": "kwong4 mai4",
  "boxes": [
    {
      "meaning": "fanatic person",
      "english": [
        {
          "id": "9cd4gjrr",
          "word": "fanatic",
          "meaning": "fanatic person",
          "note": "Use this especially for someone fanatically devoted to a sport, celebrity, hobby, or other interest."
        }
      ],
      "examples": [
        {
          "english": "Ming is a football fanatic who watches every match.",
          "traditional": "阿明係個足球狂迷，場場波都追住睇。",
          "jyutping": "aa3 ming4 hai6 go3 zuk1 kau4 kwong4 mai4 coeng4 coeng4 bo1 dou1 zeoi1 zyu6 tai2"
        }
      ]
    }
  ]
}
