{
  "id": "3pj2k5sj",
  "partOfSpeech": "verb",
  "traditional": "分裂",
  "jyutping": "fan1 lit6",
  "boxes": [
    {
      "meaning": "split into factions",
      "english": [
        {
          "id": "f32qucrt",
          "word": "splinter",
          "meaning": "split into factions",
          "note": "Use this when a government, party, group, or coalition breaks into opposing factions."
        },
        {
          "id": "qd1uw4a0",
          "word": "divide",
          "meaning": "cause disagreement",
          "register": "formal",
          "note": "Use this for splitting a group socially or politically, especially when disagreement or hostility results."
        }
      ],
      "examples": [
        {
          "english": "The political party began to splinter into two factions over policy differences.",
          "traditional": "分裂",
          "jyutping": "fan1 lit6"
        },
        {
          "english": "This dispute caused the political party to divide.",
          "traditional": "呢場爭論令個政黨分裂。",
          "jyutping": "ni1 coeng4 zaang1 leon6 ling6 go3 zing3 dong2 fan1 lit6"
        }
      ]
    }
  ]
}
