{
  "id": "bm76b0vn",
  "partOfSpeech": "noun",
  "traditional": "逗號",
  "jyutping": "dau6 hou6",
  "boxes": [
    {
      "meaning": "punctuation mark",
      "english": [
        {
          "id": "lg4ohd0j",
          "word": "comma",
          "meaning": "punctuation mark",
          "note": "This is the all-purpose Cantonese noun for the punctuation mark comma."
        }
      ],
      "examples": [
        {
          "english": "There is a comma in this sentence, so pause briefly when reading it.",
          "traditional": "呢句有個逗號，讀嗰陣要停一停。",
          "jyutping": "ni1 geoi3 jau5 go3 dau6 hou6 duk6 go2 zan6 jiu3 ting4 jat1 ting4"
        }
      ]
    }
  ]
}
