{
  "id": "7d1lznxh",
  "partOfSpeech": "verb",
  "traditional": "講多啲",
  "jyutping": "gong2 do1 di1",
  "boxes": [
    {
      "meaning": "explain further",
      "english": [
        {
          "id": "q4dqcbqi",
          "word": "elaborate",
          "meaning": "explain further",
          "register": "colloquial",
          "note": "Use this casual expression when asking or inviting someone to say more about a point."
        }
      ],
      "register": "colloquial",
      "examples": [
        {
          "english": "This part is interesting; can you elaborate a bit more?",
          "traditional": "呢部分幾有趣，你可唔可以講多啲？",
          "jyutping": "ne1 bou6 fan6 gei2 jau5 ceoi3 nei5 ho2 m4 ho2 ji5 gong2 do1 di1"
        }
      ]
    }
  ]
}
