{
  "id": "izne951a",
  "partOfSpeech": "noun",
  "traditional": "蟋蟀",
  "jyutping": "sik1 seot1",
  "boxes": [
    {
      "meaning": "insect",
      "english": [
        {
          "id": "ddimurl8",
          "word": "cricket",
          "meaning": "insect",
          "note": "Use 蟋蟀 for the chirping insect; it is the all-purpose Cantonese noun for this sense."
        }
      ],
      "examples": [
        {
          "english": "When I was little, I often caught a cricket in the backyard.",
          "traditional": "我細個成日喺後園捉到蟋蟀。",
          "jyutping": "ngo5 sai3 go3 seng4 jat6 hai2 hau6 jyun4 zuk1 dou2 sik1 seot1"
        }
      ]
    }
  ]
}
