{
  "id": "kdbr2am9",
  "partOfSpeech": "adj",
  "traditional": "鄉下地方",
  "jyutping": "hoeng1 haa2 dei6 fong1",
  "boxes": [
    {
      "meaning": "of the countryside",
      "english": [
        {
          "id": "mcbi77mn",
          "word": "rural",
          "meaning": "of the countryside",
          "register": "colloquial",
          "note": "This is the all-purpose colloquial choice for something associated with the countryside."
        }
      ],
      "register": "colloquial",
      "examples": [
        {
          "english": "When I was little, I often stayed in a rural area with my grandma for a few days.",
          "traditional": "我細個成日跟阿婆去鄉下地方住幾日。",
          "jyutping": "ngo5 sai3 go3 seng4 jat6 gan1 aa3 po4 heoi3 hoeng1 haa2 dei6 fong1 zyu6 gei2 jat6"
        }
      ]
    }
  ]
}
