{
  "id": "17pj5ups",
  "partOfSpeech": "noun",
  "traditional": "餘波",
  "jyutping": "jyu4 bo1",
  "boxes": [
    {
      "meaning": "repercussions",
      "english": [
        {
          "id": "7dpz7u4i",
          "word": "reverberation",
          "meaning": "repercussions",
          "register": "formal",
          "note": "Use 餘波 for lingering repercussions that continue after an event, especially in society or politics."
        }
      ],
      "register": "formal",
      "examples": [
        {
          "english": "The reverberation of this controversy is still being felt in society.",
          "traditional": "呢場風波嘅餘波仲喺社會上持續緊。",
          "jyutping": "ni1 coeng4 fung1 bo1 ge3 jyu4 bo1 zung6 hai2 se5 wui2 soeng6 ci4 zuk6 gan2"
        }
      ]
    }
  ]
}
