{
  "id": "y8fev8n9",
  "partOfSpeech": "noun",
  "traditional": "選舉",
  "jyutping": "syun2 geoi2",
  "boxes": [
    {
      "meaning": "political vote",
      "english": [
        {
          "id": "2evqwjp4",
          "word": "election",
          "meaning": "political vote",
          "note": "This is the all-purpose noun for an election as a voting event or process."
        }
      ],
      "examples": [
        {
          "english": "I’m definitely going to vote in this election.",
          "traditional": "今次選舉我一定去投票。",
          "jyutping": "gam1 ci3 syun2 geoi2 ngo5 jat1 ding6 heoi3 tau4 piu3"
        }
      ]
    }
  ]
}
